site|article
daily_wire|"This week, at a rally in Georgia to mark his first 100 days in office, President Biden responded to leftist hecklers who chanted, ""Close private detention centers!"" ""Abolish ICE!"" by begging, ""I agree with you. I""m working on it, man. Give me another five days.""  ""Folks, you all know what they""re talking about,"" Biden added, according to Newsweek. ""There should be no private prisons, period… none, period. That""s what they""re talking about, private detention centers. They should not exist and we are working to close all of them… I promise you."" ""Not long after Biden took office, he signed an executive order aimed at closing all privately-run federal prisons,"" Newsweek added. ""Most private prisons in the U.S. were unaffected by the order because they are run at the state level. The order also did not apply to immigration detention centers, many of which continue to be run privately."" Immigration and Customs Enforcement (ICE) has been attacked for years by the political Left; as recently as Wednesday, the American Civil Liberties Union""s National Political Director, Ronald Newman, wrote a letter to Homeland Security Secretary Alejandro Mayorkas in which he stated, ""ICE is currently paying to maintain thousands of empty beds at enormous taxpayer expense—wasting hundreds of millions of dollars that would be better spent on alternatives to detention and other programmatic priorities. As a matter of good governance, and particularly in light of the historically low number of people in ICE detention, it is time for ICE to dramatically downscale its network of more than 200 facilities. … We urge you to announce the closure of or termination of contracts for the 39 facilities lifted in annex to this letter."" Newman previously served as ""Director of Human Rights and Refugee Protection on the National Security Council in the Obama Administration, serving under National Security Advisor Susan Rice. There, he led Administration efforts to expand the U.S. Refugee Admissions Program,"" the ACLU notes. In August 2019, Fox News reported: Immigration and Customs Enforcement (ICE) workers are facing a rapidly escalating series of threats, including protesters menacing their children and shots being fired at their offices, amid a rising tide of anti-ICE rhetoric from the left fueled by congressional Democrats, media voices and presidential hopefuls. Footage published Tuesday by Breitbart News shows protesters in Florida from groups such as Never Again Action and Black Lives Matter Alliance of Broward County threatening workers and former employees of the GEO Group, a private contractor used by ICE. The family of GEO Group""s former general counsel, John Bulfin, was threatened. One protester yelled, ""We know where all your children live throughout the country … John Bulfin you have kids in bleeped out, you have kids in bleeped out. We know everything about you and you won""t just be seeing us here."" More threats: ""We""re not actually joking. John Bulfin you go to bleeped out, you go to church on bleeped out, you live on bleeped out the road. We are not joking."" The Daily Wire is one of America""s fastest-growing conservative media companies and counter-cultural outlets for news, opinion, and entertainment. Get inside access to The Daily Wire by becoming a member."
daily_wire|"A professor at Cypress College in Southern California berated a student during a Zoom class for calling the police ""heroes."" During a communications class, Braden Ellis gave a presentation about ""cancel culture"" and why it is ""so destructive and tearing our country apart."" Ellis told The Daily Wire that during his speech, he mentioned how activists attempted to ""cancel"" the children""s show ""Paw Patrol"" in light of the anti-police sentiment stemming from the Black Lives Matter movement. Following the death of George Floyd at the hands of police, professors, activists, and journalists alike took to social media to decry why ""Paw Patrol"" was bad for reinforcing the idea that police are helpful. Ellis claims that his professor allotted a 10-minute question and answer session for students to respond to the presentation. The professor took the designated time to scold Ellis for his views. Watch:  Professor: So you brought up the police in your speech a few times. So, what is your main concern? Since, I mean, honestly … the issue is systemic. Because the whole reason we have police departments in the first place, where does it stem from? What""s our history? Going back to what another classmate was talking about, what does it stem from? It stems from people in the south wanting to capture runaway slaves. Classmate: Maybe they shouldn""t be heroes. Maybe they don""t belong on a kid""s show. Ellis: I disagree with what my classmate said … I think cops are heroes and they have to have a difficult job. But we have to — Professor: All of them? Ellis: I""d say a good majority of them. You have bad people in every business and every — Professor: A lot of police officers have committed atrocious crimes and have gotten away with it and have never been convicted of any of it. And I say it as a person that has family members who are police officers. Ellis: Yes, I understand. This is what I believe … This is not popular to say, but I do support our police. And we have bad people, and the people that do bad things should be brought to justice, I agree with that. Professor: They haven""t. Ellis: Well, I agree with you on that point of they should. Professor: So, what is your bottom line point? You""re saying police officers should be revered? Viewed as heroes? They belong on TV shows for children? Ellis: I think they are heroes in a sense because they come to your need and they come and help you. They have problems just like every other business, but we should fix that — Professor: It""s not a business. I think that""s the problem, is looking at it as a business. Because they""re actually supposed to protect and serve the people. Ellis: They do protect us. Who do we call when we""re in trouble and someone has a knife or a gun? Professor: I wouldn""t call the police. Ellis: Why wouldn""t you call the police? Professor: I don""t trust them. My life""s in more danger in their presence. Ellis: Professor, who would you call? Professor: I wouldn""t call anybody. Ellis: If someone intruded your house with a gun…would you have a gun on you? Who would you call? … Ellis: I know that it""s not popular for me to say that to you guys and people in here, but that""s what I believe about the police. Teacher: Okay. Thank you. I appreciate it. Thank you very much. Ellis told The Daily Wire that he was shocked to hear his teacher""s thoughts on policing in America. ""I was shocked to hear her comments about police, but I stood firm in my beliefs,"" Ellis said. ""We need to fight back against this liberal ideology spreading in our colleges and save America."" Cypress College did not respond to requests for comment in time for publication. Related: Work Leftists Targeting Police And Police Shows Now Target Bigger Game: ""Paw Patrol"" The Daily Wire is one of America""s fastest-growing conservative media companies and counter-cultural outlets for news, opinion, and entertainment. Get inside access to The Daily Wire by becoming a member."
daily_wire|"A nonprofit linked to the ""cancellation"" of Dr. Seuss""s books and Nickelodeon""s race-based special has teamed up with Google""s charity arm to create an ""anti-racist"" book list for K-12 teachers. La Jolla, California-based The Conscious Kid supports taking actions that ""disrupt racism"" in young children by promoting ""age-appropriate"" ""anti-racist"" literature. The organization""s website offers a slew of books for children and young adults including titles such as ""Woke Baby,"" ""M is for Melanin,"" and ""Hey Black Child."" The website also promotes the book ""Kamala and Maya""s Big Idea,"" a children""s book written by Meena Harris, the niece of Vice President Kamala Harris. In June, Google""s charity, Google.org, announced that it would partner with the nonprofit by curating a list of reading materials and lesson plans that support ""inclusive, anti-racist K-12 classrooms."" The tech giant said in a press release that it supports The Conscious Kid""s embrace of critical race theory — the theory that America is intrinsically and immutably racist. ""We""ve also teamed up with experts at The Conscious Kid to curate a list of teacher-facing reading materials as well as evaluation criteria to consider when bringing new resources into the classroom,"" the Google press release reads. ""The Conscious Kid""s selections are informed by intersectional race-center approaches including Critical Race Theory and Critical Race Media Literacy, which examine representation in the content, as well as the power dynamics behind the ownership, production, and creation of it."" The book guide says it was ""created with support from Google for Education"" and encourages educators to ""re-evaluate"" teaching classic books and opt for ""social justice books"" instead. ""Re-evaluate ""classic"" books or stories which can convey and reinforce outdated values and messaging of sexism, racism, anti-Semitism, ableism, or colonialism,"" the guide reads. ""Choose social justice books to help push back against embedded biases and reinforcing values of sexism, racism, or ableism."" According to the guide, books must ""counter whiteness as the norm or definition of success"" and avoid showcasing a character of color that succeeds when ""conforming to white values or norms."" So-called ""white values"" include individualism, objectivity, and a sense of urgency. The Conscious Kid sends ""anti-racist"" books to teachers for free for use in classrooms. ""If you are an educator, administrator, school counselor, or librarian at a Title I elementary school, you are eligible to apply to receive a set of these books for free,"" its website says, noting that ""Within 8 hours of launching this application, over 3,000 educators in all 50 states applied to receive anti-racist children""s books for their schools. We will be sending books to all of them."" On the nonprofit""s website, it thanks jewelry designer Kendra Scott for donating $20,000 to launch the fund to donate ""anti-racist"" books to schools and libraries. The nonprofit also boasts that it sent over $1.3 million in COVID-19 ""rent relief"" to families across the country, $700,000 of which went to black families and $50,000 of which went to the ""Black Trans community."" Large donors included actress Kristen Bell and journalist turned progressive activist Mona Chalabi. In the four years preceding July 2018, the most recent period covered in tax filings, it told the Internal Revenue Service it had less than $50,000 in revenue. Google.org""s partnership with The Conscious Kid is part of its broader campaign to ""amplify diversity in public education."" It donated $5 million to DonorsChoose, a platform that teachers can use to crowdsource funds for classroom projects, and $1 million to #ISeeMe, an initiative that highlights projects submitted by black and ""Latinx"" teachers. Other companies and publications such as Nickelodeon, School Library Journal, and Learning for Justice — the education arm of the left-wing Southern Poverty Law Center (SPLC) — have worked with The Conscious Kid in some capacity. The Conscious Kid was co-founded by Katie Ishizuka and Ramón Stephens. Ishizuka is the Editor-in-Chief of the School Library Journal, the largest reviewer of child and young adult literature and content. Stephens is a Ph.D. candidate in education studies at the University of California-San Diego. The duo is best known for their study that claimed the beloved author Dr. Seuss""s children""s literature is rife with ""orientalism, anti-blackness, and white supremacy."" The study surveyed 50 Dr. Seuss books and concluded that there is not enough diversity in the children""s books, many of which were written in the 1950s and feature cartoon characters with green skin. On March 2, which is Dr. Seuss""s birthday and ""National Read Across America Day,"" the publisher of Dr. Seuss""s literature announced that it would stop selling six titles, citing racist and insensitive imagery. In celebration of that day, in place of Dr. Seuss, The Conscious Kid hosted Douglas Emhoff, the husband of Kamala Harris, to read ""I Dissent: Ruth Bader Ginsburg Makes Her Mark."" The Conscious Kid expanded its audience even more when, in June, it partnered with Nickelodeon for a children""s special entitled ""Kids, Race, and Unity."" According to a Nickelodeon press release, the special featured the leaders of the Black Lives Matter movement and Ibram X. Kendi. The special also highlighted ""teen activists who are fighting racial injustice."" ""A discussion guide as well as anti-racism resources, made in partnership with The Conscious Kid and Dr. George James, will be available on nickhelps.com and Nickelodeon""s social channels following the premiere of the special,"" Nickelodeon said. The Conscious Kid also operates a subscription-based Patreon channel for parents to help them better navigate the ""intersections of race, equity, parenting, and education."" The monthly subscription fee goes towards compensating ""educators or color for our time, labor, and experiential knowledge,"" the organization""s social media presence, and more. The Conscious Kid did not respond to request for comment. Related: Oh The Places The Woke Will Go: Dr. Seuss Canceled For ""Racial Undertones"" The Daily Wire is one of America""s fastest-growing conservative media companies and counter-cultural outlets for news, opinion, and entertainment. Get inside access to The Daily Wire by becoming a member."
daily_wire|"We should ban ""State of the Union"" addresses — including pseudo ""State of the Union"" addresses — to Congress. They are a complete waste of time, and offer nothing of any value to the American people. Firstly, they are mind-numbingly long. Biden""s first address to Congress on Wednesday night lasted one hour and four minutes. Former President Donald Trump""s addresses were one hour (2017), one hour and twenty minutes (2018), one hour and twenty-two minutes (2019), and one hour and eighteen minutes (2020). Former President Barack Obama""s addresses were a little shorter, ranging from fifty-one minutes (2009) to one hour and nine minutes (2010). Former President George W. Bush""s addresses were all under an hour, and some were even under fifty minutes. Former President Bill Clinton lasted one hour and twenty-eight minutes during his 2000 ""State of the Union"" address, and one hour and twenty-four minutes in 1995. As we scroll back through the list, the average length noticeably shrinks, with Richard Nixon""s 1972 address lasting just over twenty-eight minutes. Much of the reason for the increased speaking time is the bloviated nature of the content, with addresses of recent years increasingly dedicated to an exhaustive list of ""accomplishments."" What makes matters worse is that nearly every ""accomplishment"" triggers rambunctious applause from the president""s party, while their ideological opponents remain seated, scowling with theatrical rage. However, the fundamental problem with such addresses is that they offer nothing of value that couldn""t be provided in a lengthy Twitter thread. After all, Thomas Jefferson discontinued the practice of delivering the ""State of the Union"" address in person in 1801, regarding it as too monarchical. Until 1913, the address was handwritten, sent to Congress, and read by a clerk. It was Woodrow Wilson, one of the worst presidents in American history, who reintroduced it. In fact, Jimmy Carter was the last president to give a written message instead of a spoken address, in 1981. What makes matters worse — beyond the propagandizing and self-congratulatory nature of the speech itself — is the cynical games that are played by both sides every year. Who did and didn""t clap is suddenly breaking news. The color of clothing, and the political message portrayed as a consequence, dominates conversation. Outrageous — and often false — statements are either applauded as brave proclamations or indicative of totalitarianism, depending on political affiliation. Here""s an idea: let""s embrace Jefferson""s theory and go back to written ""State of the Union"" addresses, and we can all take back a few hours of our lives. It appears that many Americans agree, given that ""President Joe Biden""s first address to a joint session of Congress on Wednesday night fared relatively poorly online,"" with reactions to the speech on social media appearing to be overwhelmingly negative. Not only that, Biden""s viewership was lower than that of Trump. Let""s follow a general rule. If hour-long political speeches add nothing to the political conversation, then let""s banish them from our screens. To tell the truth, this might affect more than just the ""State of the Union,"" but we have to start somewhere. Ian Haworth is an Editor and Writer for The Daily Wire. Follow him on Twitter at @ighaworth. The views expressed in this piece are the author""s own and do not necessarily represent those of The Daily Wire. The Daily Wire is one of America""s fastest-growing conservative media companies and counter-cultural outlets for news, opinion, and entertainment. Get inside access to The Daily Wire by becoming a member."
daily_wire|"According to reports, 23-year-old Dylan Shakespeare Robinson has been ordered to pay $12 million for his part in setting fire to a Minneapolis police station during the Black Lives Matter riots in May 2020. The fine must be paid after Robinson serves a four-year prison sentence, with the Minnesota man pleading guilty to a conspiracy to commit arson charge in December. Robinson""s lawyer said that ""there is no realistic chance"" his client will be able to afford the $12 million fine. ""Dylan Shakespeare Robinson, 23, was also ordered to serve two years of supervised release and pay back $12 million for damages that resulted from the May 2020 precinct fire,"" reported The Associated Press. ""A federal complaint accused Robinson of lighting a Molotov cocktail that another person threw toward the 3rd Precinct headquarters on East Lake Street. In addition, Robinson and others allegedly tore down a fence that surrounded the building,"" The Associated Press added. ""Three other people have pleaded guilty in federal court for their roles in the precinct fire and are awaiting sentencing,"" the report concluded. According to the BBC, Robinson was one of the thousands of people who engaged in weeks of protests and riots in Minneapolis following the death of George Floyd, with Robinson traveling 120 miles south to the city from Brainerd, Minnesota. ""Surveillance video at the precinct shows Robinson lighting an ""incendiary device"" held by another person and later setting a fire inside the station near a first-floor stairwell, officials said,"" the BBC added. ""On the night of May 28, 2020, Mr. Robinson chose to depart from lawful protest and instead engaged in violence and destruction. The arson at the Minneapolis Police Department""s Third Precinct put lives at risk and contributed to widespread lawlessness in Minneapolis,"" said Acting U.S. Attorney Anders Folk, according to a U.S. Attorney""s Office statement. ""With today""s sentence, Mr. Robinson is held accountable for his actions."" ""ATF is committed to investigating the civil unrest arsons of 2020 that occurred throughout the Twin Cities,"" said Assistant Special Agent in Charge Jeff Reed, of the ATF St. Paul Field Division. ""Arson, being inherently violent, is a serious crime that put many of our community members at risk, and it cannot be tolerated."" ""The danger posed by the defendant, in this case, was very real,"" said Michael Paul, special agent in charge of the FBI""s Minneapolis field office. ""Today""s sentencing sends a clear message — regardless of motivation, when someone is intent on conducting a violent act that breaks federal law, the FBI and our law enforcement partners will move assertively to hold them accountable. This type of behavior puts public servants and our entire community in danger, and we simply will not let it go unaddressed."" In June 2020, it was reported that damage from fires and vandalism in Minneapolis following the Black Lives Matter riots amounted to over $55 million. One month later, Gov. Walz requested federal funding after riots were estimated to have caused $500 million in damage. The Daily Wire is one of America""s fastest-growing conservative media companies and counter-cultural outlets for news, opinion, and entertainment. Get inside access to The Daily Wire by becoming a member."
