site|articlecnbc|"In tweets, corporate statements and letters to their employees, some of the nation""s top business leaders are expressing relief at the guilty verdict in the trial of former Minneapolis police officer Derek Chauvin in the murder of George Floyd. They are also calling for the country to continue to fight against systemic racism and for police reform. Chauvin was found guilty of all three charges, including second-degree murder and third-degree murder, on Tuesday. Last spring, Floyd""s murder catalyzed Black Lives Matter protests across the country and the globe. A video taken by a teenage bystander, Darnella Frazier, outside of a Minneapolis convenience store, showed Chauvin kneeling on Floyd""s neck for about nine minutes. In Floyd""s final moments, he struggled to breathe and called out for his mother. As protestors marched in the streets, companies faced scrutiny for their own records on racial equity. They were pushed to do more than simply put out statements — prompting a series of corporate commitments from overhauling how companies recruit and hire Black employees to backing mandatory deescalation training for police. Here is a round-up of reactions to the Chauvin verdict by business leaders and companies, in alphabetical order: ""There are countless examples of violence against Black men and women that don""t end this way. In the past year, a number of brutal and senseless murders of Black Americans – from Ahmaud Arbery and Breonna Taylor to Daunte Wright and many others – remind us of the stark reality and persistence of systemic racism in our country. They sparked anger, awareness and dialogue; but not the change needed to address injustice in our communities and institutions. As an airline, we bring people of all races, ethnicities and backgrounds together every day."" ""We believe Black lives matter. We know there is more work to do to achieve racial justice and equity in our society, and we remain committed to the journey."" — Excerpts from a letter sent to employees Tuesday night by American Airlines executives, CEO Doug Parker, President Robert Isom and Cedric Rockamore, vice president of global people operations and diversity and inclusion — Tim Cook, Apple CEO, said on his personal Twitter account ""While this verdict in the murder of George Floyd symbolizes some measure of progress toward racial equity and accountability, it does not fully erase our nation""s history of systemic and institutional racism. We still have a long way to go in our fight for racial justice in this country, and Best Buy""s unwavering commitment to this work is as strong as ever."" — Statement from Best Buy ""Today""s verdict confirms that George Floyd was the victim of a senseless crime. Though today""s verdict is a step toward justice in this case, unarmed Black men and women continue to die in encounters with the police. To ensure true justice and healing, our country needs to take steps to address its long history of racial inequity in law enforcement. Business Roundtable will continue to work with Members of Congress and the Administration on bipartisan policing reforms that implement national policing standards, and greater accountability, training, community engagement and transparency."" — Statement by group of CEOs, which is led by its chairman, Walmart CEO Doug McMillon — Chuck Robbins, Cisco CEO, said on his personal Twitter account ""George Floyd""s murder almost one year ago sparked a much needed reckoning on racism in America. It rightly pushed us as individuals and as a company to examine what we can and should do — what we must do — to take action to create a more equitable society. The verdict in the trial today sparks a great deal of emotion for many of us. It feels like justice has been finally served, yet it doesn""t end the grief felt by so many. It underscores the EMT""s executive management team""s commitment — shared by so many of you — to be allies, to fight systemic racism at every level, and to support all those facing injustice. It also speaks to the importance of the work we""re doing through our Action for Racial Equity commitment to help close the racial wealth gap and increase economic mobility in the U.S."" — Excerpts from a LinkedIn post by Sara Wechter, Citigroup""s head of human resources ""Right now I""m thinking of George Floyd, his family and those who knew him. I hope this verdict brings some measure of comfort to them, and to everyone who can""t help but see themselves in his story. We stand in solidarity with you, knowing that this is part of a bigger struggle against racism and injustice."" — Mark Zuckerberg, co-founder and CEO of Facebook, said in a post on the social media site ""A small measure of justice was done today. But real justice would be for George Floyd to be alive and in the arms of his family. This brutal tragedy is one page in the much larger story of systemic racism, oppression, and injustice in our country. As we continue to regularly witness unarmed Black people in America killed by police, I stand with those demanding change. We can""t un-see what Derek Chauvin did to George Floyd. We can""t un-know the truth it exposed about racism in America today. And we can""t — mustn""t — ever forget. There can be no true justice in America until liberty and equality are real for everyone. My thoughts are with George Floyd""s family today, and with so many other families who are missing their loved ones today."" — Sheryl Sandberg, chief operating officer of Facebook, said in a post on the social media site ""We are hopeful today""s verdict will allow a grieving family and a community to start to heal. However, the systemic racism and social injustice apparent in the killing of George Floyd and countless other terrible episodes in our country are deeply rooted. Together, we must remain thoughtful and determined in addressing this reality, including the unacceptable abuse of authority and power and the pain it causes – disproportionately for the Black community and other people of color. For our part, Ford and our UAW partners will continue to create a company culture where everyone feels they belong and our differences are truly valued."" — Bill Ford, executive chairman of Ford, and Jim Farley, CEO, said in a statement — Mary Barra, General Motors CEO, said on her personal Twitter account — Pat Gelsinger, Intel CEO, said on his personal Twitter account, echoing the company""s support of congressional action on police reform and advocacy for the passage of the George Floyd Justice in Policing Act ""Justice was served, it""s the beginning of a long path to fix some of these things."" ""We haven""t solved this racial inequality problem for hundreds of years, and in fact in some decades it""s gone backwards."" — Jamie Dimon, JPMorgan Chase CEO, said Wednesday at a company event — Marc Benioff, founder and CEO of Salesforce and owner of Time, quoting from a story by Time journalist Janell Ross ""Today""s verdict is a verdict against bias, against injustice; an important milepost on our collective journey. As communities, as leaders and as businesses, we must all continue to be part of the solution to shift our society, take a stand against racism and violence, and act as a catalyst of change."" — Mike Manley, Stellantis head of the Americas, said in a statement ""The murder of George Floyd last Memorial Day felt like a turning point for our country. The solidarity and stand against racism since then have been unlike anything I""ve experienced. Like outraged people everywhere, I had an overwhelming hope that today""s verdict would provide real accountability. Anything short of that would have shaken my faith that our country had truly turned a corner. Today""s guilty verdict in the Derek Chauvin trial is another sign of forward progress. As I think about the Minneapolis Police Department denouncing the brutality George Floyd faced, and the disgrace expressed by multiple witnesses, the jury""s verdict reassures me that we will not go backward. Sadly, this kind of tragedy did not end last May 25, and our country has a lot of work to do and a long way to go. I can""t imagine how difficult these months have been for the family and friends of George Floyd. They are very much in my thoughts, and I hope today""s verdict offers some measure of solace. I am also thinking about our Black team members in particular. I know this trial cannot erase the pain that comes from years of inequalities and inequities. What I want to offer today is my promise that we as a company will continue to use our values and actions to advance empathy and understanding and to confront individual bias and systemic racism. Today""s verdict does not mean that our work is done. There""s much more to do as we support healing in our hometown of Minneapolis and across the country. We have to keep moving forward, together, toward a safe and equitable future for all."" — Letter sent to employees Tuesday night by Target CEO Brian Cornell — Jeff Lawson, co-founder and CEO of Twilio, said on his personal Twitter account — Dara Khosrowshahi, Uber CEO, said on his personal Twitter account ""This has been an especially painful time in our nation, particularly for Black and African Americans and communities of color. We hope today""s verdict is an initial step towards justice and healing. Wells Fargo is committed to fostering a culture that supports diversity, equity and inclusion, both within our company and the communities we serve.  As we move forward, we are working to create meaningful change and will continue supporting our employees, partners and investing in our communities because it""s our responsibility as a corporate citizen and the right thing to do."" — Statement shared by a Wells Fargo spokesperson — Eric Yuan, Zoom co-founder and CEO, said on his personal Twitter account, which included a copy of a letter sent to employees — CNBC""s Leslie Josephs, Phil LeBeau, Ari Levy, Hugh Son, Michael Wayland and Sarah Whitten contributed to this report."
fox_news|"Fox News 'Outnumbered' panel weighs in on Sen. Tim Scott getting praise for rebuttal to Biden's speech. Some prominent liberal groups, including Black Lives Matter and the National Association for the Advancement of Colored People (NAACP), haven't weighed in on the ""Uncle Tim"" Twitter insults lobbed at Sen. Tim Scott Wednesday night. Scott, R-S.C., the only Black Republican in the Senate, delivered Republicans' response to President Biden's address to a joint session of Congress. The senator, who is behind a push for police reform legislation and had a bill on the issue blocked via filibuster by Senate Democrats last year, made headlines by declaring ""America is not a racist country."" ""I've also experienced a different kind of intolerance,"" Scott also said. ""I get called Uncle Tom and the N-word by progressives, by liberals. Just last week, a national newspaper suggested my family's poverty was actually a privilege."" TIM SCOTT RESPONDS TO 'STUNNING' ASSAULT FROM LEFT: 'THEY'RE LITERALLY ATTACKING THE COLOR OF MY SKIN' Those comments and other elements of his speech led many liberals to write Twitter posts changing the racial insult ""Uncle Tom"" to ""Uncle Tim"" in reference to the senator. Some Black people used the term, including left-wing activists Bree Newsome and Tariq Nasheed, as well as commentator Touré. But some White progressives also used the term, including television personality Scott Nevins, who later apologized. The term was trending for hours before Twitter eventually blocked it Thursday morning, saying the move was ""in line with our policies on Trends... to promote healthy conversations on Twitter."" Republicans widely condemned the use of the term to refer to Scott. And Scott himself addressed the comments on ""Fox & Friends"" Thursday morning. ""Intolerance so often comes from the left with words like 'Uncle Tim' and the 'n-word' being used against me,"" Scott said. ""And last night what was trending in social media was 'Uncle Tim,' and they doubled down on this concept of liberal oppression. It is stunning in 2021 that those who speak about ending discrimination want to end it by more discrimination."" LIBERALS ERUPTED ON TIM SCOTT FOR SAYING AMERICA ISN'T RACIST, BUT KAMALA HARRIS AGREES ""The left has... doubled down that they are going to, not attack my policies, but they're literally attacking the color of my skin,"" he added. ""You can't step out of your lane according to the liberal elite left."" But the NAACP and Black Lives Matter, two groups whose mission is to fight discrimination, have not made any statements on the attacks against Scott. Neither group responded to requests for comment from Fox News on Thursday. The only apparent public reaction to Scott's speech from either group was a Wednesday night tweet from the NAACP that was critical of Scott's comment that ""America is not a racist country."" ""America is not a racist country!?!"" the group posted. ""@TimScottSC we should have a Word or a Word of Prayer!"" Scott, who is seen by some as a potential 2024 presidential contender, was widely praised by Republicans for his Wednesday response. Those on the right are likely to continue to discuss Scott's speech and the Democrats' reaction to it as Congress moves ahead with discussions on police reform. CLICK HERE TO GET THE FOX NEWS APP New Hampshire Republican Party Chairman Steve Stepanek on Thursday said comments directed against Scott by ""the left"" are ""outrageous."" Stepanek continued to say ""they""re looking for ways to poke holes in his life and take away from him what he""s accomplished. That""s just unacceptable to me and I think Americans are getting sick of it."" Biden on Wednesday asked Congress to put a police reform bill on his desk by next month, ahead of the first anniversary of George Floyd's death. Fox News' Paul Steinhauser and Brandon Gillespie contributed to this report."
fox_news|"Fox News Flash top headlines are here. Check out what's clicking on Foxnews.com. Black Lives Matter co-founder Alicia Garza commented on systemic racism over the weekend, saying that despite some progress racism ""is everywhere, it's almost like the air we breathe."" Garcia was speaking with MSNBC's Ali Velshi about the incoming administration of President-elect Joe Biden and what she and other activists expected. In a previous conversation, Garcia told Velshi she wanted to see Biden tackle: an uprooting of racism in every aspect of daily life, the reallocation of resources and the strengthing of oversight measures for law enforcement agencies. BLACK LIVES MATTER CALLS FOR 'MONTHLY' STIMULUS CHECKS FOR FAMILIES CRUSHED BY PANDEMIC ""Let's talk about that first one, uprooting racism in policing,"" Velshi said. ""You made a really good point the other day. This is racism. It's not the same as bad cops."" ""So here's the thing about uprooting systemic racism, one it's everywhere. It's almost like the air we breathe,"" Garza replied. ""So that is why we have to actually know what we're looking for in order to not just diagnose the problem but to address it."" She added that racism is about rules that have been manipulated to give power to one group over another. ""That is why we have such deep racial inequities when you look at health care, when you look at education... policing and law enforcement,"" she said. ""It is because there are rules and policies that are being enforced that actually hold up these disparities."" Garza said she focused on the issue because of the nationwide racial reckoning and protests seen last year after the death of George Floyd while in Minneapolis police custody. ""We have not gone far enough,"" Garza said. ""Consciousness is good but changing rules and making new and better ones is even better."" CLICK HERE TO GET THE FOX NEWS APP She also commented on the defund the police movement, which calls for the diversion of some police funds to community programs and for greater accountability for police officers. ""I'm just simply making the argument that the words are not complicated,"" she said. ""Police in this country actually have more rights than civilians do. Also, police budgets and military budgets in this country are incredibly bloated and at the same time we have .. schools that are underresourced."""
fox_news|"Black Lives Matter may be the single most powerful political party in the United States. Tucker Carlson opened Monday's edition of ""Tucker Carlson Tonight"" with a discussion of the popularity of the Black Lives Matter movement, describing it as the first political party that cannot be criticized without professional or personal consequences ""The media, in their relentlessly fawning coverage, usually describe Black Lives Matter as an activist group or protest movement,"" the host said. ""But that's deception by understatement. Black Lives Matter is not a collection of marchers with signs. It's not a conventional political lobby like Planned Parenthood or the NRA ... It is working to remake the country and then to control it. It's a political party. ""As of tonight, Black Lives Matter may be the single most powerful party in the United States,"" Carlson contiued. ""Nobody says that out loud but politicians understand it perfectly well. If nothing else, they understand power -- they can smell it at great distances. That is why they are lining up to bow before Black Lives Matter."" BIDEN ONCE CALLED CONFEDERATE HERITAGE GROUP 'FINE PEOPLE' The host pointed out that Republicans, as well as Democrats, have been bowing to the new party, with none other than Sen. Mitt Romney, R-Utah, taking part in a protest march in recent weeks. ""Republican leaders brag about their strong conservative convictions, but mostly they just want to be on the winning team, whatever that is,"" Carlson said. ""That is why they pause before offending China. It's why when Black Lives Matter tells them to take a knee, they do. ""It's all pretty strange when you think about it. If the leaders of Black Lives Matter are political actors, and they are, then by definition you are allowed to have any opinion you want to have about them."" ""Imagine a world,"" the host said later, ""where you are punished for questioning the behavior of the president or for insulting your local mayor. You probably can't imagine that because it's too bizarre. It is un-American but that is where we are right now. Black Lives Matter has changed the rules and here is the first new rule: No criticizing Black Lives Matter. ""You can be fired from your job if you disobey. Many Americans have been,"" he said. CLICK HERE TO GET THE FOX NEWS APP Those Americans include a Vermont principal who posted a status to her personal Facebook page about the importance of protecting both black lives and law enforcement. The local superintendent described the post as ""outright racist."" Similarly, the Federal Reserve Bank of Chicago cut ties with one of its scholars, a University of Chicago economics professor who claimed the movement had BLM ""torpedoed itself"" by backing the ""hashtag of defund the police."" ""Black Lives Matter now enjoys almost complete immunity from criticism,"" Carlson said. ""This is unprecedented for an American political movement but Black Lives Matter is more powerful than that. It has singlehandedly revised our moral framework ..."" ""Affirming the fundamental equality of all people is now considered hate speech,"" he added. ""You can be fired for saying it. Again, many people have been. This is a dangerous moment."""
fox_news|"Fox News Flash top headlines are here. Check out what's clicking on Foxnews.com. The leader of the largest Protestant Christian denomination in the country shocked many when he urged his members to declare ""black lives matter"" and denounced using ""all lives matter."" J.D. Greear, the president of the Southern Baptist Convention (SBC), made the comments during his annual address delivered on Facebook due to coronavirus orders limiting public gatherings. JOEL OSTEEN CALLS FLOYD""S DEATH ""TURNING POINT"" FOR HIM ""Southern Baptists, we need to say it clearly as a gospel issue: Black lives matter,"" Greear said. ""Of course black lives matter. Our black brothers and sisters are made in the image of God. Black lives matter because Jesus died for them."" Southern Baptist Convention President J.D. Greear gave the annual address via Facebook Live due to coronavirus restrictions on public gatherings. (Facebook/J.D. Greear) The SBC president made the comments in the wake of George Floyd's May 25 death while in police custody, something that he said shed light on the injustices ""that our black brothers and sisters have been telling us for years."" Last year, the focus of the address was sexual abuse. ""And, oh by the way, let's not respond by saying 'all lives matter,'"" Greear said. JOE CONCHA: WHY RIGHT NOW IS A 'VERY SCARY TIME FOR FREE THOUGHT' ""I realize that the movement and the website has been hijacked by some political operatives whose worldview and policy prescriptions would be deeply at odds with my own, but that doesn""t mean the sentiment behind it is untrue,"" Greear added. ""I do not align myself with the Black Lives Matter organization, and I think saying bold things like 'defund the police' is unhelpful and deeply disrespectful to many public servants who bravely put themselves in harm""s way every day to protect us."" Greear, who is the pastor of the Summit Church in Durham, N.C., added, ""But I know that we need to take a deep look at our police systems and structures and ask what we""re missing. Where are we missing the mark? And I""ll say that we do that because black lives matter."" The Rev. Dwight McKissic, pastor of Cornerstone Baptist Church, a predominantly African-American congregation in Arlington, Texas, told the Houston Chronicle he was shocked but ""thankful beyond measure"" to hear Greear""s comments, which he praised as ""sensible,"" ""therapeutic"" and ""without qualification or equivocation."" ""It""s almost surreal to me that it would come off the lips of a president of the Southern Baptist Convention,"" McKissic said. ""It""s true, it""s right and it should have been said 50 years ago."" CLICK HERE TO GET THE FOX NEWS APP Greear said the SBC leadership doesn't reflect the diversity in its churches. Southern Baptists have seen the sharpest decline in membership in the last 100 years, according to an annual church profile conducted by LifeWay Research."
